{
  "version": 1,
  "type": "source-program-audio-state",
  "commandId": "aud_aaaaaaaaaaaaaaaa",
  "assignmentId": "asn_aaaaaaaaaaaaaaaa",
  "programId": "prg_aaaaaaaaaaaaaaaa",
  "programEpoch": 1,
  "leaseId": "lea_aaaaaaaaaaaaaaaa",
  "fencingRevision": 1,
  "audioRevision": 3,
  "observedAt": 1800000000000,
  "sources": [
    {
      "sourceLeaseId": "sls_aaaaaaaaaaaaaaaa",
      "leftGainQ15": 16384,
      "rightGainQ15": 8192,
      "muted": true,
      "sourceKind": "microphone"
    }
  ]
}
